
*** Running vivado
    with args -log top_debug_system.vdi -applog -m64 -product Vivado -messageDb vivado.pb -mode batch -source top_debug_system.tcl -notrace



****** Vivado v2025.2 (64-bit)
  **** SW Build 6299465 on Fri Nov 14 19:35:11 GMT 2025
  **** IP Build 6300035 on Fri Nov 14 10:48:45 MST 2025
  **** SharedData Build 6298862 on Thu Nov 13 04:50:51 MST 2025
  **** Start of session at: Sat Jan 24 14:49:40 2026
    ** Copyright 1986-2022 Xilinx, Inc. All Rights Reserved.
    ** Copyright 2022-2025 Advanced Micro Devices, Inc. All Rights Reserved.

source top_debug_system.tcl -notrace
create_project: Time (s): cpu = 00:00:12 ; elapsed = 00:00:08 . Memory (MB): peak = 560.477 ; gain = 254.500
Command: link_design -top top_debug_system -part xc7a35tcpg236-1
Design is defaulting to srcset: sources_1
Design is defaulting to constrset: constrs_1
INFO: [Device 21-403] Loading part xc7a35tcpg236-1
INFO: [Project 1-5699] Read binary netlist with skipMacroContent - 1
INFO: [Project 1-454] Reading design checkpoint 'c:/Users/ignac/Downloads/project_1/project_1.gen/sources_1/ip/clk_wiz_50m/clk_wiz_50m.dcp' for cell 'u_clk_wiz'
Netlist sorting complete. Time (s): cpu = 00:00:00 ; elapsed = 00:00:00.061 . Memory (MB): peak = 788.562 ; gain = 0.000
INFO: [Netlist 29-17] Analyzing 768 Unisim elements for replacement
INFO: [Netlist 29-28] Unisim Transformation completed in 0 CPU seconds
INFO: [Project 1-479] Netlist was created with Vivado 2025.2
INFO: [Project 1-570] Preparing netlist for logic optimization
Parsing XDC File [c:/Users/ignac/Downloads/project_1/project_1.gen/sources_1/ip/clk_wiz_50m/clk_wiz_50m_board.xdc] for cell 'u_clk_wiz/inst'
Finished Parsing XDC File [c:/Users/ignac/Downloads/project_1/project_1.gen/sources_1/ip/clk_wiz_50m/clk_wiz_50m_board.xdc] for cell 'u_clk_wiz/inst'
Parsing XDC File [c:/Users/ignac/Downloads/project_1/project_1.gen/sources_1/ip/clk_wiz_50m/clk_wiz_50m.xdc] for cell 'u_clk_wiz/inst'
INFO: [Timing 38-35] Done setting XDC timing constraints. [c:/Users/ignac/Downloads/project_1/project_1.gen/sources_1/ip/clk_wiz_50m/clk_wiz_50m.xdc:54]
INFO: [Timing 38-2] Deriving generated clocks [c:/Users/ignac/Downloads/project_1/project_1.gen/sources_1/ip/clk_wiz_50m/clk_wiz_50m.xdc:54]
get_clocks: Time (s): cpu = 00:00:07 ; elapsed = 00:00:07 . Memory (MB): peak = 1492.844 ; gain = 573.406
Finished Parsing XDC File [c:/Users/ignac/Downloads/project_1/project_1.gen/sources_1/ip/clk_wiz_50m/clk_wiz_50m.xdc] for cell 'u_clk_wiz/inst'
Parsing XDC File [C:/Users/ignac/Downloads/project_1/project_1.srcs/constrs_1/new/Basys3_Master.xdc]
Finished Parsing XDC File [C:/Users/ignac/Downloads/project_1/project_1.srcs/constrs_1/new/Basys3_Master.xdc]
INFO: [Opt 31-138] Pushed 0 inverter(s) to 0 load pin(s).
Netlist sorting complete. Time (s): cpu = 00:00:00 ; elapsed = 00:00:00.003 . Memory (MB): peak = 1492.844 ; gain = 0.000
INFO: [Project 1-111] Unisim Transformation Summary:
  A total of 108 instances were transformed.
  RAM128X1D => RAM128X1D (MUXF7(x2), RAMD64E(x4)): 64 instances
  RAM64M => RAM64M (RAMD64E(x4)): 44 instances

11 Infos, 0 Warnings, 0 Critical Warnings and 0 Errors encountered.
link_design completed successfully
link_design: Time (s): cpu = 00:00:12 ; elapsed = 00:00:14 . Memory (MB): peak = 1492.844 ; gain = 919.391
Command: opt_design
Attempting to get a license for feature 'Implementation' and/or device 'xc7a35t'
INFO: [Common 17-349] Got license for feature 'Implementation' and/or device 'xc7a35t'
Running DRC as a precondition to command opt_design

Starting DRC Task
INFO: [DRC 23-27] Running DRC with 2 threads
INFO: [Project 1-461] DRC finished with 0 Errors
INFO: [Project 1-462] Please refer to the DRC report (report_drc) for more information.

Time (s): cpu = 00:00:02 ; elapsed = 00:00:01 . Memory (MB): peak = 1492.844 ; gain = 0.000

Starting Cache Timing Information Task
INFO: [Timing 38-35] Done setting XDC timing constraints.
INFO: [Timing 38-2] Deriving generated clocks
Ending Cache Timing Information Task | Checksum: 270757668

Time (s): cpu = 00:00:00 ; elapsed = 00:00:00.282 . Memory (MB): peak = 1519.031 ; gain = 26.188

Starting Logic Optimization Task

Phase 1 Initialization

Phase 1.1 Core Generation And Design Setup
Phase 1.1 Core Generation And Design Setup | Checksum: 270757668

Time (s): cpu = 00:00:00 ; elapsed = 00:00:00.007 . Memory (MB): peak = 1969.855 ; gain = 0.000

Phase 1.2 Setup Constraints And Sort Netlist
Phase 1.2 Setup Constraints And Sort Netlist | Checksum: 270757668

Time (s): cpu = 00:00:00 ; elapsed = 00:00:00.013 . Memory (MB): peak = 1969.855 ; gain = 0.000
Phase 1 Initialization | Checksum: 270757668

Time (s): cpu = 00:00:00 ; elapsed = 00:00:00.015 . Memory (MB): peak = 1969.855 ; gain = 0.000

Phase 2 Timer Update And Timing Data Collection

Phase 2.1 Detect if minReqCache needed
Phase 2.1 Detect if minReqCache needed | Checksum: 270757668

Time (s): cpu = 00:00:00 ; elapsed = 00:00:00.025 . Memory (MB): peak = 1969.879 ; gain = 0.023

Phase 2.2 Timer Update
Phase 2.2 Timer Update | Checksum: 270757668

Time (s): cpu = 00:00:00 ; elapsed = 00:00:00.331 . Memory (MB): peak = 1969.879 ; gain = 0.023

Phase 2.3 Timing Data Collection
Phase 2.3 Timing Data Collection | Checksum: 270757668

Time (s): cpu = 00:00:00 ; elapsed = 00:00:00.339 . Memory (MB): peak = 1969.879 ; gain = 0.023
Phase 2 Timer Update And Timing Data Collection | Checksum: 270757668

Time (s): cpu = 00:00:00 ; elapsed = 00:00:00.341 . Memory (MB): peak = 1969.879 ; gain = 0.023

Phase 3 Retarget
INFO: [Opt 31-1851] Number of loadless carry chains removed were: 0
INFO: [Opt 31-1834] Total Chains To Be Transformed Were: 0 AND Number of Transformed insts Created are: 0
INFO: [Opt 31-1566] Pulled 5 inverters resulting in an inversion of 20 pins
INFO: [Opt 31-138] Pushed 0 inverter(s) to 0 load pin(s).
INFO: [Opt 31-49] Retargeted 0 cell(s).
Phase 3 Retarget | Checksum: 191731314

Time (s): cpu = 00:00:01 ; elapsed = 00:00:00.452 . Memory (MB): peak = 1969.879 ; gain = 0.023
Retarget | Checksum: 191731314
INFO: [Opt 31-389] Phase Retarget created 0 cells and removed 5 cells
INFO: [Opt 31-1021] In phase Retarget, 1 netlist objects are constrained preventing optimization. Please run opt_design with -debug_log to get more detail. 

Phase 4 Constant propagation
INFO: [Opt 31-138] Pushed 0 inverter(s) to 0 load pin(s).
Phase 4 Constant propagation | Checksum: 24fee8e43

Time (s): cpu = 00:00:01 ; elapsed = 00:00:00.509 . Memory (MB): peak = 1969.879 ; gain = 0.023
Constant propagation | Checksum: 24fee8e43
INFO: [Opt 31-389] Phase Constant propagation created 0 cells and removed 0 cells

Phase 5 Sweep
INFO: [Constraints 18-11670] Building netlist checker database with flags, 0x8
Done building netlist checker database: Time (s): cpu = 00:00:00 ; elapsed = 00:00:00.002 . Memory (MB): peak = 1969.879 ; gain = 0.000
Phase 5 Sweep | Checksum: 1e7834fe1

Time (s): cpu = 00:00:01 ; elapsed = 00:00:00.562 . Memory (MB): peak = 1969.879 ; gain = 0.023
Sweep | Checksum: 1e7834fe1
INFO: [Opt 31-389] Phase Sweep created 0 cells and removed 0 cells

Phase 6 BUFG optimization
Phase 6 BUFG optimization | Checksum: 1e7834fe1

Time (s): cpu = 00:00:01 ; elapsed = 00:00:00.631 . Memory (MB): peak = 1969.879 ; gain = 0.023
BUFG optimization | Checksum: 1e7834fe1
INFO: [Opt 31-662] Phase BUFG optimization created 0 cells of which 0 are BUFGs and removed 0 cells.

Phase 7 Shift Register Optimization
INFO: [Opt 31-1064] SRL Remap converted 0 SRLs to 0 registers and converted 0 registers of register chains to 0 SRLs
Phase 7 Shift Register Optimization | Checksum: 1e7834fe1

Time (s): cpu = 00:00:01 ; elapsed = 00:00:00.645 . Memory (MB): peak = 1969.879 ; gain = 0.023
Shift Register Optimization | Checksum: 1e7834fe1
INFO: [Opt 31-389] Phase Shift Register Optimization created 0 cells and removed 0 cells

Phase 8 Post Processing Netlist
Phase 8 Post Processing Netlist | Checksum: 1e7834fe1

Time (s): cpu = 00:00:01 ; elapsed = 00:00:00.665 . Memory (MB): peak = 1969.879 ; gain = 0.023
Post Processing Netlist | Checksum: 1e7834fe1
INFO: [Opt 31-389] Phase Post Processing Netlist created 0 cells and removed 0 cells

Phase 9 Finalization

Phase 9.1 Finalizing Design Cores and Updating Shapes
Phase 9.1 Finalizing Design Cores and Updating Shapes | Checksum: 33628ce9b

Time (s): cpu = 00:00:01 ; elapsed = 00:00:00.723 . Memory (MB): peak = 1969.879 ; gain = 0.023

Phase 9.2 Verifying Netlist Connectivity

Starting Connectivity Check Task

Time (s): cpu = 00:00:00 ; elapsed = 00:00:00.018 . Memory (MB): peak = 1969.879 ; gain = 0.000
Phase 9.2 Verifying Netlist Connectivity | Checksum: 33628ce9b

Time (s): cpu = 00:00:01 ; elapsed = 00:00:00.743 . Memory (MB): peak = 1969.879 ; gain = 0.023
Phase 9 Finalization | Checksum: 33628ce9b

Time (s): cpu = 00:00:01 ; elapsed = 00:00:00.745 . Memory (MB): peak = 1969.879 ; gain = 0.023
Opt_design Change Summary
=========================


-------------------------------------------------------------------------------------------------------------------------
|  Phase                        |  #Cells created  |  #Cells Removed  |  #Constrained objects preventing optimizations  |
-------------------------------------------------------------------------------------------------------------------------
|  Retarget                     |               0  |               5  |                                              1  |
|  Constant propagation         |               0  |               0  |                                              0  |
|  Sweep                        |               0  |               0  |                                              0  |
|  BUFG optimization            |               0  |               0  |                                              0  |
|  Shift Register Optimization  |               0  |               0  |                                              0  |
|  Post Processing Netlist      |               0  |               0  |                                              0  |
-------------------------------------------------------------------------------------------------------------------------


Ending Logic Optimization Task | Checksum: 33628ce9b

Time (s): cpu = 00:00:01 ; elapsed = 00:00:00.749 . Memory (MB): peak = 1969.879 ; gain = 0.023

Starting Power Optimization Task
INFO: [Pwropt 34-132] Skipping clock gating for clocks with a period < 2.00 ns.
Ending Power Optimization Task | Checksum: 33628ce9b

Time (s): cpu = 00:00:00 ; elapsed = 00:00:00.016 . Memory (MB): peak = 1969.879 ; gain = 0.000

Starting Final Cleanup Task
Ending Final Cleanup Task | Checksum: 33628ce9b

Time (s): cpu = 00:00:00 ; elapsed = 00:00:00.002 . Memory (MB): peak = 1969.879 ; gain = 0.000
Netlist sorting complete. Time (s): cpu = 00:00:00 ; elapsed = 00:00:00.003 . Memory (MB): peak = 1969.879 ; gain = 0.000
INFO: [Common 17-83] Releasing license: Implementation
34 Infos, 0 Warnings, 0 Critical Warnings and 0 Errors encountered.
opt_design completed successfully
opt_design: Time (s): cpu = 00:00:07 ; elapsed = 00:00:07 . Memory (MB): peak = 1969.879 ; gain = 477.035
INFO: [Vivado 12-24828] Executing command : report_drc -file top_debug_system_drc_opted.rpt -pb top_debug_system_drc_opted.pb -rpx top_debug_system_drc_opted.rpx
Command: report_drc -file top_debug_system_drc_opted.rpt -pb top_debug_system_drc_opted.pb -rpx top_debug_system_drc_opted.rpx
INFO: [IP_Flow 19-1839] IP Catalog is up to date.
INFO: [DRC 23-27] Running DRC with 2 threads
INFO: [Vivado_Tcl 2-168] The results of DRC are in file C:/Users/ignac/Downloads/project_1/project_1.runs/impl_1/top_debug_system_drc_opted.rpt.
report_drc completed successfully
INFO: [Timing 38-480] Writing timing data to binary archive.
Wrote PlaceDB: Time (s): cpu = 00:00:00 ; elapsed = 00:00:00 . Memory (MB): peak = 1969.879 ; gain = 0.000
Wrote PulsedLatchDB: Time (s): cpu = 00:00:00 ; elapsed = 00:00:00.001 . Memory (MB): peak = 1969.879 ; gain = 0.000
Writing XDEF routing.
Write ShapeDB Complete: Time (s): cpu = 00:00:00 ; elapsed = 00:00:00.060 . Memory (MB): peak = 1969.879 ; gain = 0.000
Writing XDEF routing logical nets.
Writing XDEF routing special nets.
Wrote RouteStorage: Time (s): cpu = 00:00:00 ; elapsed = 00:00:00.085 . Memory (MB): peak = 1969.879 ; gain = 0.000
Wrote PlaceStorage: Time (s): cpu = 00:00:00 ; elapsed = 00:00:00.001 . Memory (MB): peak = 1969.879 ; gain = 0.000
Wrote Netlist Cache: Time (s): cpu = 00:00:00 ; elapsed = 00:00:00.001 . Memory (MB): peak = 1969.879 ; gain = 0.000
Wrote Device Cache: Time (s): cpu = 00:00:00 ; elapsed = 00:00:00.018 . Memory (MB): peak = 1969.879 ; gain = 0.000
Write Physdb Complete: Time (s): cpu = 00:00:00 ; elapsed = 00:00:00.139 . Memory (MB): peak = 1969.879 ; gain = 0.000
INFO: [Common 17-1381] The checkpoint 'C:/Users/ignac/Downloads/project_1/project_1.runs/impl_1/top_debug_system_opt.dcp' has been generated.
Command: place_design
Attempting to get a license for feature 'Implementation' and/or device 'xc7a35t'
INFO: [Common 17-349] Got license for feature 'Implementation' and/or device 'xc7a35t'
INFO: [Common 17-83] Releasing license: Implementation
INFO: [DRC 23-27] Running DRC with 2 threads
INFO: [Vivado_Tcl 4-198] DRC finished with 0 Errors
INFO: [Vivado_Tcl 4-199] Please refer to the DRC report (report_drc) for more information.
INFO: [Timing 38-35] Done setting XDC timing constraints.
Running DRC as a precondition to command place_design
INFO: [DRC 23-27] Running DRC with 2 threads
INFO: [Vivado_Tcl 4-198] DRC finished with 0 Errors
INFO: [Vivado_Tcl 4-199] Please refer to the DRC report (report_drc) for more information.
INFO: [Place 30-611] Multithreading enabled for place_design using a maximum of 2 CPUs

Starting Placer Task

Phase 1 Placer Initialization

Phase 1.1 Placer Initialization Netlist Sorting
Netlist sorting complete. Time (s): cpu = 00:00:00 ; elapsed = 00:00:00.003 . Memory (MB): peak = 1969.879 ; gain = 0.000
Phase 1.1 Placer Initialization Netlist Sorting | Checksum: 239a498ce

Time (s): cpu = 00:00:00 ; elapsed = 00:00:00.006 . Memory (MB): peak = 1969.879 ; gain = 0.000
Netlist sorting complete. Time (s): cpu = 00:00:00 ; elapsed = 00:00:00.002 . Memory (MB): peak = 1969.879 ; gain = 0.000

Phase 1.2 IO Placement/ Clock Placement/ Build Placer Device
Phase 1.2 IO Placement/ Clock Placement/ Build Placer Device | Checksum: 157f557ef

Time (s): cpu = 00:00:00 ; elapsed = 00:00:00.357 . Memory (MB): peak = 1969.879 ; gain = 0.000

Phase 1.3 Build Placer Netlist Model
Phase 1.3 Build Placer Netlist Model | Checksum: 1744d1553

Time (s): cpu = 00:00:03 ; elapsed = 00:00:03 . Memory (MB): peak = 1969.879 ; gain = 0.000

Phase 1.4 Constrain Clocks/Macros
Phase 1.4 Constrain Clocks/Macros | Checksum: 1744d1553

Time (s): cpu = 00:00:03 ; elapsed = 00:00:03 . Memory (MB): peak = 1969.879 ; gain = 0.000
Phase 1 Placer Initialization | Checksum: 1744d1553

Time (s): cpu = 00:00:04 ; elapsed = 00:00:03 . Memory (MB): peak = 1969.879 ; gain = 0.000

Phase 2 Global Placement

Phase 2.1 Floorplanning
Phase 2.1 Floorplanning | Checksum: 16f52b5f3

Time (s): cpu = 00:00:04 ; elapsed = 00:00:03 . Memory (MB): peak = 1969.879 ; gain = 0.000

Phase 2.2 Update Timing before SLR Path Opt
Phase 2.2 Update Timing before SLR Path Opt | Checksum: 1f30d55ed

Time (s): cpu = 00:00:05 ; elapsed = 00:00:04 . Memory (MB): peak = 1969.879 ; gain = 0.000

Phase 2.3 Post-Processing in Floorplanning
Phase 2.3 Post-Processing in Floorplanning | Checksum: 1f30d55ed

Time (s): cpu = 00:00:05 ; elapsed = 00:00:04 . Memory (MB): peak = 1969.879 ; gain = 0.000

Phase 2.4 Global Place Phase1
Phase 2.4 Global Place Phase1 | Checksum: 1e1859441

Time (s): cpu = 00:00:09 ; elapsed = 00:00:06 . Memory (MB): peak = 1969.879 ; gain = 0.000

Phase 2.5 Global Place Phase2

Phase 2.5.1 UpdateTiming Before Physical Synthesis
Phase 2.5.1 UpdateTiming Before Physical Synthesis | Checksum: 1f27070cc

Time (s): cpu = 00:00:11 ; elapsed = 00:00:07 . Memory (MB): peak = 1969.879 ; gain = 0.000

Phase 2.5.2 Physical Synthesis In Placer
INFO: [Physopt 32-1035] Found 0 LUTNM shape to break, 41 LUT instances to create LUTNM shape
INFO: [Physopt 32-1044] Break lutnm for timing: one critical 0, two critical 0, total 0, new lutff created 0
INFO: [Physopt 32-1138] End 1 Pass. Optimized 17 nets or LUTs. Breaked 0 LUT, combined 17 existing LUTs and moved 0 existing LUT
INFO: [Physopt 32-65] No nets found for high-fanout optimization.
INFO: [Physopt 32-232] Optimized 0 net. Created 0 new instance.
INFO: [Physopt 32-775] End 1 Pass. Optimized 0 net or cell. Created 0 new cell, deleted 0 existing cell and moved 0 existing cell
INFO: [Physopt 32-670] No setup violation found.  DSP Register Optimization was not performed.
INFO: [Physopt 32-670] No setup violation found.  Shift Register to Pipeline Optimization was not performed.
INFO: [Physopt 32-670] No setup violation found.  Shift Register Optimization was not performed.
INFO: [Physopt 32-670] No setup violation found.  BRAM Register Optimization was not performed.
INFO: [Physopt 32-670] No setup violation found.  URAM Register Optimization was not performed.
INFO: [Physopt 32-949] No candidate nets found for dynamic/static region interface net replication
INFO: [Physopt 32-775] End 1 Pass. Optimized 0 net or cell. Created 0 new cell, deleted 0 existing cell and moved 0 existing cell
Netlist sorting complete. Time (s): cpu = 00:00:00 ; elapsed = 00:00:00.003 . Memory (MB): peak = 1969.879 ; gain = 0.000

Summary of Physical Synthesis Optimizations
============================================


-----------------------------------------------------------------------------------------------------------------------------------------------------------
|  Optimization                                     |  Added Cells  |  Removed Cells  |  Optimized Cells/Nets  |  Dont Touch  |  Iterations  |  Elapsed   |
-----------------------------------------------------------------------------------------------------------------------------------------------------------
|  LUT Combining                                    |            0  |             17  |                    17  |           0  |           1  |  00:00:00  |
|  Retime                                           |            0  |              0  |                     0  |           0  |           1  |  00:00:00  |
|  Very High Fanout                                 |            0  |              0  |                     0  |           0  |           1  |  00:00:00  |
|  DSP Register                                     |            0  |              0  |                     0  |           0  |           0  |  00:00:00  |
|  Shift Register to Pipeline                       |            0  |              0  |                     0  |           0  |           0  |  00:00:00  |
|  Shift Register                                   |            0  |              0  |                     0  |           0  |           0  |  00:00:00  |
|  BRAM Register                                    |            0  |              0  |                     0  |           0  |           0  |  00:00:00  |
|  URAM Register                                    |            0  |              0  |                     0  |           0  |           0  |  00:00:00  |
|  Dynamic/Static Region Interface Net Replication  |            0  |              0  |                     0  |           0  |           1  |  00:00:00  |
|  Total                                            |            0  |             17  |                    17  |           0  |           4  |  00:00:00  |
-----------------------------------------------------------------------------------------------------------------------------------------------------------


Phase 2.5.2 Physical Synthesis In Placer | Checksum: 19d5b36bc

Time (s): cpu = 00:00:12 ; elapsed = 00:00:08 . Memory (MB): peak = 1969.879 ; gain = 0.000
Phase 2.5 Global Place Phase2 | Checksum: 15c9f8442

Time (s): cpu = 00:00:13 ; elapsed = 00:00:09 . Memory (MB): peak = 1969.879 ; gain = 0.000
Phase 2 Global Placement | Checksum: 15c9f8442

Time (s): cpu = 00:00:13 ; elapsed = 00:00:09 . Memory (MB): peak = 1969.879 ; gain = 0.000

Phase 3 Detail Placement

Phase 3.1 Commit Multi Column Macros
Phase 3.1 Commit Multi Column Macros | Checksum: 20bb9c40e

Time (s): cpu = 00:00:14 ; elapsed = 00:00:09 . Memory (MB): peak = 1969.879 ; gain = 0.000

Phase 3.2 Commit Most Macros & LUTRAMs
Phase 3.2 Commit Most Macros & LUTRAMs | Checksum: 18143cf2e

Time (s): cpu = 00:00:16 ; elapsed = 00:00:10 . Memory (MB): peak = 1969.879 ; gain = 0.000

Phase 3.3 Area Swap Optimization
Phase 3.3 Area Swap Optimization | Checksum: 1044ceaab

Time (s): cpu = 00:00:16 ; elapsed = 00:00:11 . Memory (MB): peak = 1969.879 ; gain = 0.000

Phase 3.4 Pipeline Register Optimization
Phase 3.4 Pipeline Register Optimization | Checksum: 173b63d49

Time (s): cpu = 00:00:16 ; elapsed = 00:00:11 . Memory (MB): peak = 1969.879 ; gain = 0.000

Phase 3.5 Small Shape Detail Placement
Phase 3.5 Small Shape Detail Placement | Checksum: 17be8dd73

Time (s): cpu = 00:00:19 ; elapsed = 00:00:13 . Memory (MB): peak = 1969.879 ; gain = 0.000

Phase 3.6 Re-assign LUT pins
Phase 3.6 Re-assign LUT pins | Checksum: 227849019

Time (s): cpu = 00:00:20 ; elapsed = 00:00:14 . Memory (MB): peak = 1969.879 ; gain = 0.000

Phase 3.7 Pipeline Register Optimization
Phase 3.7 Pipeline Register Optimization | Checksum: 297a921fb

Time (s): cpu = 00:00:20 ; elapsed = 00:00:14 . Memory (MB): peak = 1969.879 ; gain = 0.000
Phase 3 Detail Placement | Checksum: 297a921fb

Time (s): cpu = 00:00:20 ; elapsed = 00:00:14 . Memory (MB): peak = 1969.879 ; gain = 0.000

Phase 4 Post Placement Optimization and Clean-Up

Phase 4.1 Post Commit Optimization
INFO: [Timing 38-35] Done setting XDC timing constraints.

Phase 4.1.1 Post Placement Optimization
Post Placement Optimization Initialization | Checksum: 1f55dcc6e

Phase 4.1.1.1 BUFG Insertion

Starting Physical Synthesis Task

Phase 1 Physical Synthesis Initialization
INFO: [Physopt 32-721] Multithreading enabled for phys_opt_design using a maximum of 2 CPUs
INFO: [Physopt 32-619] Estimated Timing Summary | WNS=8.883 | TNS=0.000 |
Phase 1 Physical Synthesis Initialization | Checksum: 1731f9f9a

Time (s): cpu = 00:00:00 ; elapsed = 00:00:00.231 . Memory (MB): peak = 1969.879 ; gain = 0.000
INFO: [Place 46-33] Processed net u_cpu/u_id/u_rf/SR[0], BUFG insertion was skipped due to placement/routing conflicts.
INFO: [Place 46-56] BUFG insertion identified 1 candidate nets. Inserted BUFG: 0, Replicated BUFG Driver: 0, Skipped due to Placement/Routing Conflicts: 1, Skipped due to Timing Degradation: 0, Skipped due to netlist editing failed: 0.
Ending Physical Synthesis Task | Checksum: 2e387b7d1

Time (s): cpu = 00:00:01 ; elapsed = 00:00:00.471 . Memory (MB): peak = 1969.879 ; gain = 0.000
Phase 4.1.1.1 BUFG Insertion | Checksum: 1f55dcc6e

Time (s): cpu = 00:00:24 ; elapsed = 00:00:17 . Memory (MB): peak = 1969.879 ; gain = 0.000

Phase 4.1.1.2 Post Placement Timing Optimization
INFO: [Place 30-746] Post Placement Timing Summary WNS=8.883. For the most accurate timing information please run report_timing.
Phase 4.1.1.2 Post Placement Timing Optimization | Checksum: 21bc3e4c5

Time (s): cpu = 00:00:24 ; elapsed = 00:00:17 . Memory (MB): peak = 1969.879 ; gain = 0.000

Time (s): cpu = 00:00:24 ; elapsed = 00:00:17 . Memory (MB): peak = 1969.879 ; gain = 0.000
Phase 4.1 Post Commit Optimization | Checksum: 21bc3e4c5

Time (s): cpu = 00:00:24 ; elapsed = 00:00:17 . Memory (MB): peak = 1969.879 ; gain = 0.000

Phase 4.2 Post Placement Cleanup
Phase 4.2 Post Placement Cleanup | Checksum: 21bc3e4c5

Time (s): cpu = 00:00:24 ; elapsed = 00:00:17 . Memory (MB): peak = 1969.879 ; gain = 0.000

Phase 4.3 Placer Reporting

Phase 4.3.1 Print Estimated Congestion
INFO: [Place 30-612] Post-Placement Estimated Congestion 
 ____________________________________________________
|           | Global Congestion | Short Congestion  |
| Direction | Region Size       | Region Size       |
|___________|___________________|___________________|
|      North|                1x1|                4x4|
|___________|___________________|___________________|
|      South|                1x1|                2x2|
|___________|___________________|___________________|
|       East|                1x1|                1x1|
|___________|___________________|___________________|
|       West|                1x1|                1x1|
|___________|___________________|___________________|

Phase 4.3.1 Print Estimated Congestion | Checksum: 21bc3e4c5

Time (s): cpu = 00:00:24 ; elapsed = 00:00:17 . Memory (MB): peak = 1969.879 ; gain = 0.000
Phase 4.3 Placer Reporting | Checksum: 21bc3e4c5

Time (s): cpu = 00:00:24 ; elapsed = 00:00:17 . Memory (MB): peak = 1969.879 ; gain = 0.000

Phase 4.4 Final Placement Cleanup
Netlist sorting complete. Time (s): cpu = 00:00:00 ; elapsed = 00:00:00.006 . Memory (MB): peak = 1969.879 ; gain = 0.000

Time (s): cpu = 00:00:24 ; elapsed = 00:00:17 . Memory (MB): peak = 1969.879 ; gain = 0.000
Phase 4 Post Placement Optimization and Clean-Up | Checksum: 1e16fe7c9

Time (s): cpu = 00:00:24 ; elapsed = 00:00:17 . Memory (MB): peak = 1969.879 ; gain = 0.000
Ending Placer Task | Checksum: 1acaf8508

Time (s): cpu = 00:00:24 ; elapsed = 00:00:17 . Memory (MB): peak = 1969.879 ; gain = 0.000
70 Infos, 0 Warnings, 0 Critical Warnings and 0 Errors encountered.
place_design completed successfully
place_design: Time (s): cpu = 00:00:26 ; elapsed = 00:00:18 . Memory (MB): peak = 1969.879 ; gain = 0.000
INFO: [Vivado 12-24838] Running report commands "report_control_sets, report_io, report_utilization" in parallel.
Running report generation with 2 threads.
INFO: [Vivado 12-24828] Executing command : report_io -file top_debug_system_io_placed.rpt
report_io: Time (s): cpu = 00:00:00 ; elapsed = 00:00:00.074 . Memory (MB): peak = 1969.879 ; gain = 0.000
INFO: [Vivado 12-24828] Executing command : report_utilization -file top_debug_system_utilization_placed.rpt -pb top_debug_system_utilization_placed.pb
INFO: [Vivado 12-24828] Executing command : report_control_sets -verbose -file top_debug_system_control_sets_placed.rpt
report_control_sets: Time (s): cpu = 00:00:00 ; elapsed = 00:00:00.026 . Memory (MB): peak = 1969.879 ; gain = 0.000
INFO: [Timing 38-480] Writing timing data to binary archive.
Wrote PlaceDB: Time (s): cpu = 00:00:00 ; elapsed = 00:00:00 . Memory (MB): peak = 1969.879 ; gain = 0.000
Wrote PulsedLatchDB: Time (s): cpu = 00:00:00 ; elapsed = 00:00:00 . Memory (MB): peak = 1969.879 ; gain = 0.000
Writing XDEF routing.
Write ShapeDB Complete: Time (s): cpu = 00:00:00 ; elapsed = 00:00:00.022 . Memory (MB): peak = 1969.879 ; gain = 0.000
Writing XDEF routing logical nets.
Writing XDEF routing special nets.
Wrote RouteStorage: Time (s): cpu = 00:00:00 ; elapsed = 00:00:00.035 . Memory (MB): peak = 1969.879 ; gain = 0.000
Wrote PlaceStorage: Time (s): cpu = 00:00:01 ; elapsed = 00:00:00.375 . Memory (MB): peak = 1969.879 ; gain = 0.000
Wrote Netlist Cache: Time (s): cpu = 00:00:00 ; elapsed = 00:00:00.010 . Memory (MB): peak = 1969.879 ; gain = 0.000
Wrote Device Cache: Time (s): cpu = 00:00:00 ; elapsed = 00:00:00.008 . Memory (MB): peak = 1969.879 ; gain = 0.000
Write Physdb Complete: Time (s): cpu = 00:00:01 ; elapsed = 00:00:00.442 . Memory (MB): peak = 1969.879 ; gain = 0.000
INFO: [Common 17-1381] The checkpoint 'C:/Users/ignac/Downloads/project_1/project_1.runs/impl_1/top_debug_system_placed.dcp' has been generated.
Command: phys_opt_design
Attempting to get a license for feature 'Implementation' and/or device 'xc7a35t'
INFO: [Common 17-349] Got license for feature 'Implementation' and/or device 'xc7a35t'

Starting Initial Update Timing Task

Time (s): cpu = 00:00:03 ; elapsed = 00:00:02 . Memory (MB): peak = 1969.879 ; gain = 0.000
INFO: [Vivado_Tcl 4-2279] Estimated Timing Summary | WNS= 8.883 | TNS= 0.000 | 
INFO: [Vivado_Tcl 4-383] Design worst setup slack (WNS) is greater than or equal to 0.000 ns. All physical synthesis setup optimizations will be skipped.
INFO: [Vivado_Tcl 4-232] No setup violation found. The netlist was not modified.
INFO: [Common 17-83] Releasing license: Implementation
81 Infos, 0 Warnings, 0 Critical Warnings and 0 Errors encountered.
phys_opt_design completed successfully
INFO: [Timing 38-480] Writing timing data to binary archive.
Wrote PlaceDB: Time (s): cpu = 00:00:00 ; elapsed = 00:00:00 . Memory (MB): peak = 1969.879 ; gain = 0.000
Wrote PulsedLatchDB: Time (s): cpu = 00:00:00 ; elapsed = 00:00:00 . Memory (MB): peak = 1969.879 ; gain = 0.000
Writing XDEF routing.
Write ShapeDB Complete: Time (s): cpu = 00:00:00 ; elapsed = 00:00:00.027 . Memory (MB): peak = 1969.879 ; gain = 0.000
Writing XDEF routing logical nets.
Writing XDEF routing special nets.
Wrote RouteStorage: Time (s): cpu = 00:00:00 ; elapsed = 00:00:00.034 . Memory (MB): peak = 1969.879 ; gain = 0.000
Wrote PlaceStorage: Time (s): cpu = 00:00:01 ; elapsed = 00:00:00.387 . Memory (MB): peak = 1969.879 ; gain = 0.000
Wrote Netlist Cache: Time (s): cpu = 00:00:00 ; elapsed = 00:00:00.009 . Memory (MB): peak = 1969.879 ; gain = 0.000
Wrote Device Cache: Time (s): cpu = 00:00:00 ; elapsed = 00:00:00.008 . Memory (MB): peak = 1969.879 ; gain = 0.000
Write Physdb Complete: Time (s): cpu = 00:00:01 ; elapsed = 00:00:00.454 . Memory (MB): peak = 1969.879 ; gain = 0.000
INFO: [Common 17-1381] The checkpoint 'C:/Users/ignac/Downloads/project_1/project_1.runs/impl_1/top_debug_system_physopt.dcp' has been generated.
Command: route_design
Attempting to get a license for feature 'Implementation' and/or device 'xc7a35t'
INFO: [Common 17-349] Got license for feature 'Implementation' and/or device 'xc7a35t'


Starting Routing Task
INFO: [Route 35-254] Multithreading enabled for route_design using a maximum of 2 CPUs

Phase 1 Build RT Design
Checksum: PlaceDB: a7bd9512 ConstDB: 0 ShapeSum: 6470939f RouteDB: a0815c57
Post Restoration Checksum: NetGraph: b9d59d86 | NumContArr: 9ad0886b | Constraints: c2a8fa9d | Timing: c2a8fa9d
Phase 1 Build RT Design | Checksum: 2d9f81b2b

Time (s): cpu = 00:00:30 ; elapsed = 00:00:27 . Memory (MB): peak = 1969.879 ; gain = 0.000

Phase 2 Router Initialization

Phase 2.1 Fix Topology Constraints
Phase 2.1 Fix Topology Constraints | Checksum: 2d9f81b2b

Time (s): cpu = 00:00:31 ; elapsed = 00:00:27 . Memory (MB): peak = 1969.879 ; gain = 0.000

Phase 2.2 Pre Route Cleanup
Phase 2.2 Pre Route Cleanup | Checksum: 2d9f81b2b

Time (s): cpu = 00:00:31 ; elapsed = 00:00:27 . Memory (MB): peak = 1969.879 ; gain = 0.000
 Number of Nodes with overlaps = 0

Phase 2.3 Update Timing
Phase 2.3 Update Timing | Checksum: 19e860d4d

Time (s): cpu = 00:00:35 ; elapsed = 00:00:30 . Memory (MB): peak = 1969.879 ; gain = 0.000
INFO: [Route 35-416] Intermediate Timing Summary | WNS=9.170  | TNS=0.000  | WHS=-0.264 | THS=-106.286|


Phase 2.4 Soft Constraint Pins - Fast Budgeting
Phase 2.4 Soft Constraint Pins - Fast Budgeting | Checksum: 1ecf123ea

Time (s): cpu = 00:00:36 ; elapsed = 00:00:31 . Memory (MB): peak = 1969.879 ; gain = 0.000

Router Utilization Summary
  Global Vertical Routing Utilization    = 0 %
  Global Horizontal Routing Utilization  = 0 %
  Routable Net Status*
  *Does not include unroutable nets such as driverless and loadless.
  Run report_route_status for detailed report.
  Number of Failed Nets               = 3450
    (Failed Nets is the sum of unrouted and partially routed nets)
  Number of Unrouted Nets             = 3450
  Number of Partially Routed Nets     = 0
  Number of Node Overlaps             = 0

Phase 2 Router Initialization | Checksum: 20e8ad264

Time (s): cpu = 00:00:36 ; elapsed = 00:00:31 . Memory (MB): peak = 1969.879 ; gain = 0.000

Phase 3 Global Routing
Phase 3 Global Routing | Checksum: 20e8ad264

Time (s): cpu = 00:00:36 ; elapsed = 00:00:31 . Memory (MB): peak = 1969.879 ; gain = 0.000

Phase 4 Initial Routing

Phase 4.1 Initial Net Routing Pass
Phase 4.1 Initial Net Routing Pass | Checksum: 20e2193ad

Time (s): cpu = 00:00:38 ; elapsed = 00:00:32 . Memory (MB): peak = 1969.879 ; gain = 0.000
Phase 4 Initial Routing | Checksum: 20e2193ad

Time (s): cpu = 00:00:38 ; elapsed = 00:00:32 . Memory (MB): peak = 1969.879 ; gain = 0.000

Phase 5 Rip-up And Reroute

Phase 5.1 Global Iteration 0
 Number of Nodes with overlaps = 717
 Number of Nodes with overlaps = 32
 Number of Nodes with overlaps = 6
 Number of Nodes with overlaps = 1
 Number of Nodes with overlaps = 1
 Number of Nodes with overlaps = 0
INFO: [Route 35-416] Intermediate Timing Summary | WNS=7.681  | TNS=0.000  | WHS=N/A    | THS=N/A    |

Phase 5.1 Global Iteration 0 | Checksum: 19b63b5e2

Time (s): cpu = 00:00:45 ; elapsed = 00:00:37 . Memory (MB): peak = 1969.879 ; gain = 0.000
Phase 5 Rip-up And Reroute | Checksum: 19b63b5e2

Time (s): cpu = 00:00:45 ; elapsed = 00:00:37 . Memory (MB): peak = 1969.879 ; gain = 0.000

Phase 6 Delay and Skew Optimization

Phase 6.1 Delay CleanUp

Phase 6.1.1 Update Timing
Phase 6.1.1 Update Timing | Checksum: 22062a995

Time (s): cpu = 00:00:46 ; elapsed = 00:00:38 . Memory (MB): peak = 1969.879 ; gain = 0.000
INFO: [Route 35-416] Intermediate Timing Summary | WNS=7.761  | TNS=0.000  | WHS=N/A    | THS=N/A    |

Phase 6.1 Delay CleanUp | Checksum: 22062a995

Time (s): cpu = 00:00:46 ; elapsed = 00:00:38 . Memory (MB): peak = 1969.879 ; gain = 0.000

Phase 6.2 Clock Skew Optimization
Phase 6.2 Clock Skew Optimization | Checksum: 22062a995

Time (s): cpu = 00:00:46 ; elapsed = 00:00:38 . Memory (MB): peak = 1969.879 ; gain = 0.000
Phase 6 Delay and Skew Optimization | Checksum: 22062a995

Time (s): cpu = 00:00:46 ; elapsed = 00:00:38 . Memory (MB): peak = 1969.879 ; gain = 0.000

Phase 7 Post Hold Fix

Phase 7.1 Hold Fix Iter
INFO: [Route 35-416] Intermediate Timing Summary | WNS=7.761  | TNS=0.000  | WHS=0.052  | THS=0.000  |

Phase 7.1 Hold Fix Iter | Checksum: 206b9efc5

Time (s): cpu = 00:00:47 ; elapsed = 00:00:38 . Memory (MB): peak = 1969.879 ; gain = 0.000
Phase 7 Post Hold Fix | Checksum: 206b9efc5

Time (s): cpu = 00:00:47 ; elapsed = 00:00:38 . Memory (MB): peak = 1969.879 ; gain = 0.000

Phase 8 Route finalize

Router Utilization Summary
  Global Vertical Routing Utilization    = 1.73762 %
  Global Horizontal Routing Utilization  = 2.27043 %
  Routable Net Status*
  *Does not include unroutable nets such as driverless and loadless.
  Run report_route_status for detailed report.
  Number of Failed Nets               = 0
    (Failed Nets is the sum of unrouted and partially routed nets)
  Number of Unrouted Nets             = 0
  Number of Partially Routed Nets     = 0
  Number of Node Overlaps             = 0

Phase 8 Route finalize | Checksum: 206b9efc5

Time (s): cpu = 00:00:47 ; elapsed = 00:00:38 . Memory (MB): peak = 1969.879 ; gain = 0.000

Phase 9 Verifying routed nets

 Verification completed successfully
Phase 9 Verifying routed nets | Checksum: 206b9efc5

Time (s): cpu = 00:00:47 ; elapsed = 00:00:38 . Memory (MB): peak = 1969.879 ; gain = 0.000

Phase 10 Depositing Routes
Phase 10 Depositing Routes | Checksum: 2c12886ba

Time (s): cpu = 00:00:48 ; elapsed = 00:00:39 . Memory (MB): peak = 1969.879 ; gain = 0.000

Phase 11 Post Process Routing
Phase 11 Post Process Routing | Checksum: 2c12886ba

Time (s): cpu = 00:00:48 ; elapsed = 00:00:39 . Memory (MB): peak = 1969.879 ; gain = 0.000

Phase 12 Post Router Timing
INFO: [Route 35-57] Estimated Timing Summary | WNS=7.761  | TNS=0.000  | WHS=0.052  | THS=0.000  |

INFO: [Route 35-327] The final timing numbers are based on the router estimated timing analysis. For a complete and accurate timing signoff, please run report_timing_summary.
Phase 12 Post Router Timing | Checksum: 2c12886ba

Time (s): cpu = 00:00:48 ; elapsed = 00:00:39 . Memory (MB): peak = 1969.879 ; gain = 0.000
Total Elapsed time in route_design: 39.221 secs

Phase 13 Post-Route Event Processing
Phase 13 Post-Route Event Processing | Checksum: 1b2faacab

Time (s): cpu = 00:00:48 ; elapsed = 00:00:39 . Memory (MB): peak = 1969.879 ; gain = 0.000
INFO: [Route 35-16] Router Completed Successfully
Ending Routing Task | Checksum: 1b2faacab

Time (s): cpu = 00:00:48 ; elapsed = 00:00:39 . Memory (MB): peak = 1969.879 ; gain = 0.000

Routing Is Done.
INFO: [Common 17-83] Releasing license: Implementation
93 Infos, 0 Warnings, 0 Critical Warnings and 0 Errors encountered.
route_design completed successfully
route_design: Time (s): cpu = 00:00:48 ; elapsed = 00:00:39 . Memory (MB): peak = 1969.879 ; gain = 0.000
INFO: [Vivado 12-24828] Executing command : report_drc -file top_debug_system_drc_routed.rpt -pb top_debug_system_drc_routed.pb -rpx top_debug_system_drc_routed.rpx
Command: report_drc -file top_debug_system_drc_routed.rpt -pb top_debug_system_drc_routed.pb -rpx top_debug_system_drc_routed.rpx
INFO: [IP_Flow 19-1839] IP Catalog is up to date.
INFO: [DRC 23-27] Running DRC with 2 threads
INFO: [Vivado_Tcl 2-168] The results of DRC are in file C:/Users/ignac/Downloads/project_1/project_1.runs/impl_1/top_debug_system_drc_routed.rpt.
report_drc completed successfully
INFO: [Vivado 12-24828] Executing command : report_methodology -file top_debug_system_methodology_drc_routed.rpt -pb top_debug_system_methodology_drc_routed.pb -rpx top_debug_system_methodology_drc_routed.rpx
Command: report_methodology -file top_debug_system_methodology_drc_routed.rpt -pb top_debug_system_methodology_drc_routed.pb -rpx top_debug_system_methodology_drc_routed.rpx
INFO: [Timing 38-35] Done setting XDC timing constraints.
INFO: [DRC 23-133] Running Methodology with 2 threads
INFO: [Vivado_Tcl 2-1520] The results of Report Methodology are in file C:/Users/ignac/Downloads/project_1/project_1.runs/impl_1/top_debug_system_methodology_drc_routed.rpt.
report_methodology completed successfully
report_drc: Time (s): cpu = 00:00:09 ; elapsed = 00:00:05 . Memory (MB): peak = 1969.879 ; gain = 0.000
INFO: [Vivado 12-24828] Executing command : report_timing_summary -max_paths 10 -routable_nets -report_unconstrained -file top_debug_system_timing_summary_routed.rpt -pb top_debug_system_timing_summary_routed.pb -rpx top_debug_system_timing_summary_routed.rpx -warn_on_violation 
INFO: [Timing 38-35] Done setting XDC timing constraints.
INFO: [Timing 38-91] UpdateTimingParams: Speed grade: -1, Delay Type: min_max.
INFO: [Timing 38-191] Multithreading enabled for timing update using a maximum of 2 CPUs
INFO: [Vivado 12-24838] Running report commands "report_incremental_reuse, report_route_status" in parallel.
Running report generation with 2 threads.
INFO: [Vivado 12-24828] Executing command : report_incremental_reuse -file top_debug_system_incremental_reuse_routed.rpt
INFO: [Vivado_Tcl 4-1062] Incremental flow is disabled. No incremental reuse Info to report.
INFO: [Vivado 12-24828] Executing command : report_route_status -file top_debug_system_route_status.rpt -pb top_debug_system_route_status.pb
INFO: [Vivado 12-24828] Executing command : report_power -file top_debug_system_power_routed.rpt -pb top_debug_system_power_summary_routed.pb -rpx top_debug_system_power_routed.rpx
Command: report_power -file top_debug_system_power_routed.rpt -pb top_debug_system_power_summary_routed.pb -rpx top_debug_system_power_routed.rpx
Running Vector-less Activity Propagation...

Finished Running Vector-less Activity Propagation
110 Infos, 0 Warnings, 0 Critical Warnings and 0 Errors encountered.
report_power completed successfully
INFO: [Vivado 12-24828] Executing command : report_clock_utilization -file top_debug_system_clock_utilization_routed.rpt
INFO: [Vivado 12-24828] Executing command : report_bus_skew -warn_on_violation -file top_debug_system_bus_skew_routed.rpt -pb top_debug_system_bus_skew_routed.pb -rpx top_debug_system_bus_skew_routed.rpx
INFO: [Timing 38-91] UpdateTimingParams: Speed grade: -1, Delay Type: min_max.
INFO: [Timing 38-191] Multithreading enabled for timing update using a maximum of 2 CPUs
generate_parallel_reports: Time (s): cpu = 00:00:20 ; elapsed = 00:00:13 . Memory (MB): peak = 1969.879 ; gain = 0.000
INFO: [Timing 38-480] Writing timing data to binary archive.
Wrote PlaceDB: Time (s): cpu = 00:00:00 ; elapsed = 00:00:00 . Memory (MB): peak = 1969.879 ; gain = 0.000
Wrote PulsedLatchDB: Time (s): cpu = 00:00:00 ; elapsed = 00:00:00 . Memory (MB): peak = 1969.879 ; gain = 0.000
Writing XDEF routing.
Write ShapeDB Complete: Time (s): cpu = 00:00:00 ; elapsed = 00:00:00.018 . Memory (MB): peak = 1969.879 ; gain = 0.000
Writing XDEF routing logical nets.
Writing XDEF routing special nets.
Wrote RouteStorage: Time (s): cpu = 00:00:01 ; elapsed = 00:00:00.128 . Memory (MB): peak = 1969.879 ; gain = 0.000
Wrote PlaceStorage: Time (s): cpu = 00:00:01 ; elapsed = 00:00:00.614 . Memory (MB): peak = 1969.879 ; gain = 0.000
Wrote Netlist Cache: Time (s): cpu = 00:00:00 ; elapsed = 00:00:00.014 . Memory (MB): peak = 1969.879 ; gain = 0.000
Wrote Device Cache: Time (s): cpu = 00:00:00 ; elapsed = 00:00:00.012 . Memory (MB): peak = 1969.879 ; gain = 0.000
Write Physdb Complete: Time (s): cpu = 00:00:02 ; elapsed = 00:00:00.788 . Memory (MB): peak = 1969.879 ; gain = 0.000
INFO: [Common 17-1381] The checkpoint 'C:/Users/ignac/Downloads/project_1/project_1.runs/impl_1/top_debug_system_routed.dcp' has been generated.
INFO: [Common 17-206] Exiting Vivado at Sat Jan 24 14:51:32 2026...

*** Running vivado
    with args -log top_debug_system.vdi -applog -m64 -product Vivado -messageDb vivado.pb -mode batch -source top_debug_system.tcl -notrace



****** Vivado v2025.2 (64-bit)
  **** SW Build 6299465 on Fri Nov 14 19:35:11 GMT 2025
  **** IP Build 6300035 on Fri Nov 14 10:48:45 MST 2025
  **** SharedData Build 6298862 on Thu Nov 13 04:50:51 MST 2025
  **** Start of session at: Sat Jan 24 14:51:49 2026
    ** Copyright 1986-2022 Xilinx, Inc. All Rights Reserved.
    ** Copyright 2022-2025 Advanced Micro Devices, Inc. All Rights Reserved.

source top_debug_system.tcl -notrace
Command: open_checkpoint top_debug_system_routed.dcp
INFO: [Device 21-403] Loading part xc7a35tcpg236-1
Netlist sorting complete. Time (s): cpu = 00:00:00 ; elapsed = 00:00:00.101 . Memory (MB): peak = 776.188 ; gain = 0.000
INFO: [Netlist 29-17] Analyzing 768 Unisim elements for replacement
INFO: [Netlist 29-28] Unisim Transformation completed in 0 CPU seconds
INFO: [Project 1-479] Netlist was created with Vivado 2025.2
INFO: [Project 1-570] Preparing netlist for logic optimization
Read ShapeDB Complete: Time (s): cpu = 00:00:00 ; elapsed = 00:00:00.021 . Memory (MB): peak = 870.746 ; gain = 1.156
INFO: [Timing 38-478] Restoring timing data from binary archive.
INFO: [Timing 38-479] Binary timing data restore complete.
INFO: [Project 1-856] Restoring constraints from binary archive.
INFO: [Project 1-853] Binary constraint restore complete.
INFO: [Designutils 20-5722] Start Reading Physical Databases.
Reading placement.
Read Netlist Cache: Time (s): cpu = 00:00:00 ; elapsed = 00:00:00.008 . Memory (MB): peak = 1482.469 ; gain = 0.000
Reading placer database...
Read Device Cache: Time (s): cpu = 00:00:00 ; elapsed = 00:00:00.012 . Memory (MB): peak = 1482.469 ; gain = 0.000
Read PlaceDB: Time (s): cpu = 00:00:00 ; elapsed = 00:00:00.001 . Memory (MB): peak = 1482.469 ; gain = 0.000
Read placeStorage: Time (s): cpu = 00:00:01 ; elapsed = 00:00:00.252 . Memory (MB): peak = 1482.469 ; gain = 0.000
Read PulsedLatchDB: Time (s): cpu = 00:00:00 ; elapsed = 00:00:00 . Memory (MB): peak = 1482.469 ; gain = 0.000
Reading routing.
Read RouteStorage: Time (s): cpu = 00:00:00 ; elapsed = 00:00:00.087 . Memory (MB): peak = 1482.469 ; gain = 0.000
Read Physdb Files: Time (s): cpu = 00:00:01 ; elapsed = 00:00:00.381 . Memory (MB): peak = 1482.469 ; gain = 0.000
Restored from archive | CPU: 1.000000 secs | Memory: 0.000000 MB |
Finished XDEF File Restore: Time (s): cpu = 00:00:01 ; elapsed = 00:00:00.454 . Memory (MB): peak = 1482.469 ; gain = 8.164
Netlist sorting complete. Time (s): cpu = 00:00:00 ; elapsed = 00:00:00.005 . Memory (MB): peak = 1482.469 ; gain = 0.000
INFO: [Project 1-111] Unisim Transformation Summary:
  A total of 108 instances were transformed.
  RAM128X1D => RAM128X1D (MUXF7(x2), RAMD64E(x4)): 64 instances
  RAM64M => RAM64M (RAMD64E(x4)): 44 instances

INFO: [Project 1-604] Checkpoint was created with Vivado v2025.2 (64-bit) build 6299465
WARNING: [Vivado 12-23575] Critical violations of the methodology design rules detected. Critical violations may contribute to timing failures or cause functional issues in hardware. Run report_methodology for more information.
open_checkpoint: Time (s): cpu = 00:00:27 ; elapsed = 00:00:25 . Memory (MB): peak = 1482.469 ; gain = 1177.391
Command: write_bitstream -force top_debug_system.bit
Attempting to get a license for feature 'Implementation' and/or device 'xc7a35t'
INFO: [Common 17-349] Got license for feature 'Implementation' and/or device 'xc7a35t'
Running DRC as a precondition to command write_bitstream
INFO: [IP_Flow 19-234] Refreshing IP repositories
INFO: [IP_Flow 19-1704] No user IP repositories specified
INFO: [IP_Flow 19-2313] Loaded Vivado IP repository 'C:/AMDDesignTools/2025.2/Vivado/data/ip'.
INFO: [DRC 23-27] Running DRC with 2 threads
INFO: [Vivado 12-3199] DRC finished with 0 Errors
INFO: [Vivado 12-3200] Please refer to the DRC report (report_drc) for more information.
Integrating Hard IP ELF/MEM with the PDI.
INFO: [Designutils 20-2272] Running write_bitstream with 2 threads.
Loading data files...
Loading site data...
Loading route data...
Processing options...
Creating bitmap...
Creating bitstream...
Bitstream compression saved 13438976 bits.
Writing bitstream ./top_debug_system.bit...
INFO: [Vivado 12-1842] Bitgen Completed Successfully.
INFO: [Common 17-83] Releasing license: Implementation
22 Infos, 1 Warnings, 0 Critical Warnings and 0 Errors encountered.
write_bitstream completed successfully
write_bitstream: Time (s): cpu = 00:00:18 ; elapsed = 00:00:14 . Memory (MB): peak = 2015.121 ; gain = 532.652
INFO: [Common 17-206] Exiting Vivado at Sat Jan 24 14:52:33 2026...
